French Phrase|English Translation|Literal Translation
Vos enfants sont très bien élevés|Your children are very well behaved.|Your children are very well raised.
Votre maison est très jolie|Your house is very nice.|Your house is very pretty.
Voudriez-vous acheter ça ?|Would you like to buy this?|Would want you to buy that?
Voudriez-vous aller vous promener ?|Would you like to go for a walk?|Would want you to go yourself to promenade?
Voudriez-vous de l'eau ou du lait ?|Would you like water or milk?|Would want you some water or some milk?
Voudriez-vous de l'eau ?|Would you like some water?|Would want you some water?
Voudriez-vous dîner avec moi ?|Would you like to have dinner with me?|Would want you to dine with me?
Voudriez-vous du café ou du thé ?|Would you like coffee or tea?|Would want you some coffee or some tea?
Voudriez-vous du vin ?|Would you like some wine?|Would want you some wine?
Voudriez-vous louer un film ?|Would you like to rent a movie?|Would want you to rent a movie?
Voudriez-vous prendre un message s'il vous plaît ?|Would you take a message please?|Would want you to take a message if it you pleases?
Voudriez-vous quelque chose à boire ?|Would you like something to drink?|Would want you something at to drink?
Voudriez-vous quelque chose à manger ?|Would you like something to eat?|Would want you something at to eat?
Voudriez-vous regarder la television ?|Would you like to watch TV?|Would want you to watch the television?
Voudriez-vous un verre d'eau ?|Would you like a glass of water?|Would want you a glass of water?
Vous attendez depuis longtemps ?|Have you been waiting long?|You wait since long-time?
Vous voilà|Here you are.|You there-is.
Vraiment ?|Really?|Truly?
